{
  "id": "av2",
  "title": "AV2, before anyone can see it",
  "description": "AV2 scored against the AVIF this site ships, at matched bytes: it wins on the sparsest thumbnails, loses on dense detail, and breaks behind a picture fallback.",
  "status": "watching",
  "added": "2026-09-27",
  "bodyHtml": "<h1>AV2, before anyone can see it</h1>\n<p class=\"garage-intro\"><a class=\"term\" data-t=\"av2\" href=\"https://en.wikipedia.org/wiki/AV2\" title=\"The video codec that follows AV1, from the Alliance for Open Media. Like AV1, it can also compress single still images.\" rel=\"external\">AV2</a> is the successor to <a class=\"term\" data-t=\"av1\" href=\"https://en.wikipedia.org/wiki/AV1\" title=\"A royalty-free video codec from the Alliance for Open Media. AVIF images are single AV1 frames stored in an image file.\" rel=\"external\">AV1</a>, the codec inside every <a class=\"term\" data-t=\"avif\" href=\"https://en.wikipedia.org/wiki/AVIF\" title=\"An image format that stores a picture compressed with the AV1 video codec. Every current major browser can display it.\" rel=\"external\">AVIF</a> image, and its reference encoder <a href=\"https://github.com/AOMediaCodec/avm\">shipped 1.0.0 in May</a>. AOM's own <a href=\"https://arxiv.org/abs/2605.15800\">all-intra report</a> puts it <data value=\"17.82% (PSNR-Y) to 23.58% (VMAF)\">18 to 24%</data> ahead of AV1 on stills. That number comes from video test sequences scored with <a class=\"term\" data-t=\"psnr\" href=\"https://en.wikipedia.org/wiki/Peak_signal-to-noise_ratio\" title=\"Peak signal-to-noise ratio: a simple score, in decibels, of how far a compressed image's pixels drift from the original. Higher means closer.\" rel=\"external\">PSNR</a>, <a class=\"term\" data-t=\"ssim\" href=\"https://en.wikipedia.org/wiki/Structural_similarity_index_measure\" title=\"Structural similarity: a score up to 1 that compares local brightness, contrast and structure between two images. Closer to 1 means more alike.\" rel=\"external\">SSIM</a> and <a class=\"term\" data-t=\"vmaf\" href=\"https://en.wikipedia.org/wiki/Video_Multimethod_Assessment_Fusion\" title=\"Netflix's video quality score, which combines several measurements into one 0 to 100 number that predicts how viewers would rate the picture.\" rel=\"external\">VMAF</a>. I wanted the answer for photographs, scored the way this site already scores its own images, at the exact byte budgets it ships. No browser can decode an AV2 image yet, so the figures below are decodes I made offline, and one section brings its own decoder to draw AV2 in your browser anyway.</p>\n\n<h2>Your browser, right now</h2>\n<p>These are three copies of the same 128 px crop. The first is AV1, the codec inside the AVIF files browsers decode today. The second is AV2 in the same container, at 2,030 bytes against AV1's 2,097. The third is how you'd try to ship AV2 safely: a <code>&lt;picture&gt;</code> source typed <code>image/avif</code>, with a <a class=\"term\" data-t=\"webp\" href=\"https://en.wikipedia.org/wiki/WebP\" title=\"Google's image format for the web. It usually compresses better than JPEG and not as well as AVIF.\" rel=\"external\">WebP</a> fallback.</p>\n<div class=\"av2-demo\" id=\"av2-demo\">\n  <figure><img id=\"av2-a\" src=\"/garage/av2/demo-av1.avif\" width=\"128\" height=\"128\" alt=\"AV1 control\"><figcaption>AV1 in AVIF</figcaption></figure>\n  <figure><img id=\"av2-b\" src=\"/garage/av2/demo-av2.avif\" width=\"128\" height=\"128\" alt=\"AV2 in AVIF\"><figcaption>AV2 in AVIF</figcaption></figure>\n  <figure><picture><source type=\"image/avif\" srcset=\"/garage/av2/demo-av2.avif\"><img id=\"av2-c\" src=\"/garage/av2/demo-fallback.webp\" width=\"128\" height=\"128\" alt=\"AV2 with a WebP fallback\"></picture><figcaption>AV2, with a fallback</figcaption></figure>\n</div>\n<p id=\"av2-verdict\" class=\"av2-verdict\">Enable JavaScript and this line reports what each image did.</p>\n<p>In Chrome 154 and Canary 156 the third image is broken, and the WebP never loads. Of everything on this page, that's the finding most likely to cost somebody an afternoon, so it comes first.</p>\n<h2>Decoding it here instead</h2>\n<p>Your browser couldn't draw that second file, but this page can. The button below fetches AOM's reference decoder, AVM 1.0.0, compiled to <a class=\"term\" data-t=\"webassembly\" href=\"https://developer.mozilla.org/en-US/docs/WebAssembly\" title=\"A compact binary format for code that browsers and other runtimes run at near-native speed, usually compiled from languages like Rust or C++.\" rel=\"external\">WebAssembly</a>, and runs it on a background thread. It's about 550 KB over the wire, which is why it waits for a click. It draws exactly the pixels the native build does: I compared every decoded sample on 16 files, from 8-bit monochrome to 10-bit 4:4:4, and all of them matched.</p>\n<p><button type=\"button\" id=\"av2-go\">Decode the AV2 images (about 550 KB)</button></p>\n<p id=\"av2-run\" class=\"av2-verdict\">Nothing has been fetched yet.</p>\n<div id=\"av2-live\" hidden>\n<figure class=\"av2-live-demo\"><canvas id=\"av2-demo-canvas\" width=\"128\" height=\"128\" aria-label=\"The demo's AV2 file, decoded in this page\"></canvas><figcaption>The 128 px AV2 file from the second slot above</figcaption></figure>\n<p>Below are four of the 600 px thumbnails this site ships, from thin to dense. Each AV1 image is the AVIF file the site actually serves, drawn by your browser's own decoder. Each AV2 image is the largest AVM 1.0.0 encode at or under that file's size, cut from the same source and drawn by the WebAssembly decoder. Click one to flip between the two.</p>\n<figure class=\"av2-pair\" data-av2=\"/garage/av2/XT507488-av2.avif\" data-av1-label=\"AV1, the shipped file, 17,205 B\" data-av2-label=\"AV2, 17,141 B\">\n  <p class=\"av2-tag\"></p>\n  <div class=\"av2-pairstack\"><img class=\"on\" src=\"/i/XT507488.f028baef.avif\" width=\"600\" height=\"600\" loading=\"lazy\" decoding=\"async\" alt=\"The shipped AV1 thumbnail\"><canvas width=\"600\" height=\"600\" aria-label=\"The AV2 encode at the same budget, decoded in this page\"></canvas></div>\n  <figcaption>0.38 bits per pixel, the sparse end. ssimulacra2 against the source: AV2 81.63, AV1 80.11.</figcaption>\n</figure>\n<figure class=\"av2-pair\" data-av2=\"/garage/av2/XT507525-av2.avif\" data-av1-label=\"AV1, the shipped file, 28,236 B\" data-av2-label=\"AV2, 27,899 B\">\n  <p class=\"av2-tag\"></p>\n  <div class=\"av2-pairstack\"><img class=\"on\" src=\"/i/XT507525.c937a50e.avif\" width=\"600\" height=\"600\" loading=\"lazy\" decoding=\"async\" alt=\"The shipped AV1 thumbnail\"><canvas width=\"600\" height=\"600\" aria-label=\"The AV2 encode at the same budget, decoded in this page\"></canvas></div>\n  <figcaption>0.63 bits per pixel, near the tier's median of 0.67. ssimulacra2: AV2 81.27, AV1 80.70.</figcaption>\n</figure>\n<figure class=\"av2-pair\" data-av2=\"/garage/av2/XT508319-av2.avif\" data-av1-label=\"AV1, the shipped file, 52,822 B\" data-av2-label=\"AV2, 52,000 B\">\n  <p class=\"av2-tag\"></p>\n  <div class=\"av2-pairstack\"><img class=\"on\" src=\"/i/XT508319.bf0268a0.avif\" width=\"600\" height=\"600\" loading=\"lazy\" decoding=\"async\" alt=\"The shipped AV1 thumbnail\"><canvas width=\"600\" height=\"600\" aria-label=\"The AV2 encode at the same budget, decoded in this page\"></canvas></div>\n  <figcaption>1.17 bits per pixel. ssimulacra2: AV2 79.44, AV1 74.70. This one is an exception: between 0.8 and 1.2 bits per pixel, the table further down counts 2 AV2 wins in 10 calls.</figcaption>\n</figure>\n<figure class=\"av2-pair\" data-av2=\"/garage/av2/XT507399-av2.avif\" data-av1-label=\"AV1, the shipped file, 91,291 B\" data-av2-label=\"AV2, 91,288 B\">\n  <p class=\"av2-tag\"></p>\n  <div class=\"av2-pairstack\"><img class=\"on\" src=\"/i/XT507399.9b833151.avif\" width=\"600\" height=\"600\" loading=\"lazy\" decoding=\"async\" alt=\"The shipped AV1 thumbnail\"><canvas width=\"600\" height=\"600\" aria-label=\"The AV2 encode at the same budget, decoded in this page\"></canvas></div>\n  <figcaption>2.03 bits per pixel, the densest photo I could reproduce. ssimulacra2: AV2 75.90, AV1 76.76, the loss the table predicts above 1.2.</figcaption>\n</figure>\n<p class=\"av2-note\">Every conforming AV1 decoder produces the same samples, and this AV2 decoder matches AVM's own, so what changes when you flip is the encode. Four photos I tried were left out: re-encoding them didn't reproduce the shipped file byte for byte, so I couldn't show that their AV1 and AV2 files started from the same pixels.</p>\n</div>\n\n\n<h2>Why the fallback doesn't catch it</h2>\n<p>A <code>&lt;picture&gt;</code> element chooses a source by its <i>declared type</i>, before any byte decodes. Chrome supports <code>image/avif</code>, so it commits to the source, fetches it, and finds an image it can't read. Nothing sends it back to the <code>&lt;img&gt;</code>, because the fallback only covers types a browser has never heard of.</p>\n<p>The file explains the rest. <a class=\"term\" data-t=\"libavif\" href=\"https://github.com/AOMediaCodec/libavif\" title=\"The reference library for reading and writing AVIF files. Its avifenc and avifdec tools wrap whichever AV1 or AV2 codec it was built with.\" rel=\"external\">libavif</a> writes AV2 inside the same box structure as AV1, and the brand still says <code>avif</code>, <code>mif1</code> and <code>miaf</code>. Only the image item changes, from <code>av01</code> to <code>av02</code>, with an <code>av2C</code> config box beside it. A careful decoder like <code>avifdec</code> skips the item it doesn't know and reports <q>Primary item not found</q>. A browser draws a broken image.</p>\n<p>So an AV2 image needs a name a browser can decline, the way <code>image/avif</code> gave AV1 stills a name that browsers without AV1 could skip. Until one exists, serving AV2 under the AVIF name breaks the image in every browser that supports AVIF, which is eve